{
  "applied_decision_ids": [
    "decision-replace-opening-wording",
    "decision-accept-relation-explanation",
    "decision-accept-motive-undecided"
  ],
  "audience_promise": {
    "lineage": {
      "authority_ids": [],
      "mode": "adapter_generated_non_factual",
      "source_span_ids": []
    },
    "statement_id": "audience-promise-case-digest",
    "statement_kind": "audience_promise",
    "text": "Evidence-limited incident digest"
  },
  "candidate_only": true,
  "caption_units": [
    {
      "caption_unit_id": "caption-case-digest-section-01-incident-1",
      "end_seconds": 12,
      "lineage": {
        "authority_ids": [],
        "decision_record_ids": [
          "decision-replace-opening-wording"
        ],
        "mode": "writer_authored_proposal",
        "source_span_ids": [
          "proposal-span-proposal-replace-opening-wording"
        ]
      },
      "section_or_beat_id": "case-digest-section-01-incident",
      "source_lineage": [
        {
          "byte_range": {
            "end": 301,
            "start": 229
          },
          "character_range": {
            "end": 185,
            "start": 161,
            "unit": "utf16_code_unit"
          },
          "decision_record_id": "decision-replace-opening-wording",
          "exact_text_sha256": "ec003f03d958ec74762ce04001c415a92a6e47c2beaded42a27be2da521ea547",
          "source_kind": "writer_authored_proposal",
          "source_path": "fixtures/writer-decision-workspace/writer-proposals.md",
          "source_span_id": "proposal-span-proposal-replace-opening-wording"
        }
      ],
      "start_seconds": 0,
      "text": "正午、鐘のない塔で鐘の音が響いたとの報告がある。"
    },
    {
      "caption_unit_id": "caption-case-digest-section-01-incident-2",
      "end_seconds": 24,
      "lineage": {
        "authority_ids": [
          "authority-span-case-digest-section-01-incident-sentence-02-observed-event",
          "authority-span-case-digest-section-01-incident-sentence-02-must-preserve"
        ],
        "mode": "source_span",
        "source_span_ids": [
          "span-case-digest-section-01-incident-sentence-02"
        ]
      },
      "section_or_beat_id": "case-digest-section-01-incident",
      "start_seconds": 12,
      "text": "塔の取付枠は空で、音を生む鐘は見当たらない。"
    },
    {
      "caption_unit_id": "caption-case-digest-section-02-investigator-1",
      "end_seconds": 38,
      "lineage": {
        "authority_ids": [
          "authority-span-case-digest-section-02-investigator-sentence-01-established-fact",
          "authority-span-case-digest-section-02-investigator-sentence-01-reported-claim",
          "authority-span-case-digest-section-02-investigator-sentence-01-must-preserve"
        ],
        "mode": "source_span",
        "source_span_ids": [
          "span-case-digest-section-02-investigator-sentence-01"
        ]
      },
      "section_or_beat_id": "case-digest-section-02-investigator",
      "start_seconds": 24,
      "text": "時計修理師のミラ・ヴェイルは、失踪した兄が残したとされるメモを調べている。"
    },
    {
      "caption_unit_id": "caption-case-digest-section-02-investigator-2",
      "end_seconds": 51,
      "lineage": {
        "authority_ids": [
          "authority-span-case-digest-section-02-investigator-sentence-02-observed-event",
          "authority-span-case-digest-section-02-investigator-sentence-02-must-preserve"
        ],
        "mode": "source_span",
        "source_span_ids": [
          "span-case-digest-section-02-investigator-sentence-02"
        ]
      },
      "section_or_beat_id": "case-digest-section-02-investigator",
      "start_seconds": 38,
      "text": "作業台には真鍮の蛾があり、時計と記録には9:17が繰り返し現れる。"
    },
    {
      "caption_unit_id": "caption-case-digest-section-02-investigator-3",
      "end_seconds": 65,
      "lineage": {
        "authority_ids": [
          "authority-span-case-digest-section-02-investigator-sentence-03-unresolved",
          "authority-span-case-digest-section-02-investigator-sentence-03-forbidden-to-infer"
        ],
        "mode": "source_span",
        "source_span_ids": [
          "span-case-digest-section-02-investigator-sentence-03"
        ]
      },
      "section_or_beat_id": "case-digest-section-02-investigator",
      "start_seconds": 51,
      "text": "メモ、蛾、9:17は一つの手掛かりの連鎖だが、兄の所在を直接示す記録ではない。"
    },
    {
      "caption_unit_id": "caption-case-digest-section-03-ledger-1",
      "end_seconds": 81,
      "lineage": {
        "authority_ids": [
          "authority-span-case-digest-section-03-ledger-sentence-01-observed-event"
        ],
        "mode": "source_span",
        "source_span_ids": [
          "span-case-digest-section-03-ledger-sentence-01"
        ]
      },
      "section_or_beat_id": "case-digest-section-03-ledger",
      "start_seconds": 65,
      "text": "調査対象の台帳には、「分」を記す欄と、人の名前を記す欄が並ぶ。"
    },
    {
      "caption_unit_id": "caption-case-digest-section-03-ledger-2",
      "end_seconds": 97,
      "lineage": {
        "authority_ids": [
          "authority-span-case-digest-section-03-ledger-sentence-03-unresolved",
          "authority-span-case-digest-section-03-ledger-sentence-03-forbidden-to-infer"
        ],
        "mode": "source_span",
        "source_span_ids": [
          "span-case-digest-section-03-ledger-sentence-03"
        ]
      },
      "section_or_beat_id": "case-digest-section-03-ledger",
      "start_seconds": 81,
      "text": "この台帳が時間を奪う、または人を消すという因果関係は証明されていない。"
    },
    {
      "caption_unit_id": "caption-case-digest-section-04-council-1",
      "end_seconds": 117,
      "lineage": {
        "authority_ids": [
          "authority-span-case-digest-section-04-council-sentence-01-reported-claim",
          "authority-span-case-digest-section-04-council-sentence-01-allegation"
        ],
        "mode": "source_span",
        "source_span_ids": [
          "span-case-digest-section-04-council-sentence-01"
        ]
      },
      "section_or_beat_id": "case-digest-section-04-council",
      "start_seconds": 97,
      "text": "失踪した兄のメモは、市の評議会に調査の目を向けている。"
    },
    {
      "caption_unit_id": "caption-case-digest-section-04-council-2",
      "end_seconds": 136,
      "lineage": {
        "authority_ids": [
          "authority-span-case-digest-section-04-council-sentence-02-forbidden-to-infer",
          "authority-span-case-digest-section-04-council-sentence-02-must-preserve"
        ],
        "mode": "source_span",
        "source_span_ids": [
          "span-case-digest-section-04-council-sentence-02"
        ]
      },
      "section_or_beat_id": "case-digest-section-04-council",
      "start_seconds": 117,
      "text": "だが、メモは告発の記録であり、評議会の関与を裏づける証拠そのものではない。"
    },
    {
      "caption_unit_id": "caption-case-digest-section-05-status-1",
      "end_seconds": 158,
      "lineage": {
        "authority_ids": [
          "authority-span-case-digest-section-05-status-sentence-01-observed-event",
          "authority-span-case-digest-section-05-status-sentence-01-must-preserve"
        ],
        "mode": "source_span",
        "source_span_ids": [
          "span-case-digest-section-05-status-sentence-01"
        ]
      },
      "section_or_beat_id": "case-digest-section-05-status",
      "start_seconds": 136,
      "text": "この事件で確認されているのは、正午に報告された鐘の音、空の取付枠、失踪した兄のメモ、真鍮の蛾、9:17、二列の台帳である。"
    },
    {
      "caption_unit_id": "caption-case-digest-section-05-status-2",
      "end_seconds": 180,
      "lineage": {
        "authority_ids": [
          "authority-span-case-digest-section-05-status-sentence-03-unresolved",
          "authority-span-case-digest-section-05-status-sentence-03-forbidden-to-infer",
          "authority-span-case-digest-section-05-status-sentence-03-must-preserve"
        ],
        "mode": "source_span",
        "source_span_ids": [
          "span-case-digest-section-05-status-sentence-03"
        ]
      },
      "section_or_beat_id": "case-digest-section-05-status",
      "start_seconds": 158,
      "text": "音源、兄の所在、評議会との関係は確認されていない。"
    }
  ],
  "closed_flags": {
    "media": false,
    "production": false,
    "provider": false,
    "publication": false,
    "render": false,
    "rights": false
  },
  "deferred_decision_ids": [
    "decision-defer-structure-reorder",
    "decision-defer-brother-survival"
  ],
  "final_canon": false,
  "format_id": "CASE_DIGEST",
  "narration_units": [
    {
      "end_seconds": 24,
      "lineage": {
        "authority_ids": [
          "authority-span-case-digest-section-01-incident-sentence-01-reported-claim",
          "authority-span-case-digest-section-01-incident-sentence-01-must-preserve",
          "authority-span-case-digest-section-01-incident-sentence-02-observed-event",
          "authority-span-case-digest-section-01-incident-sentence-02-must-preserve",
          "authority-span-case-digest-section-01-incident-sentence-03-unresolved",
          "authority-span-case-digest-section-01-incident-sentence-03-forbidden-to-infer"
        ],
        "decision_record_ids": [
          "decision-replace-opening-wording"
        ],
        "mode": "mixed_source_and_writer_authorized",
        "source_span_ids": [
          "span-case-digest-section-01-incident-sentence-01",
          "span-case-digest-section-01-incident-sentence-02",
          "span-case-digest-section-01-incident-sentence-03",
          "proposal-span-proposal-replace-opening-wording"
        ]
      },
      "narration_unit_id": "narration-case-digest-section-01-incident",
      "section_or_beat_id": "case-digest-section-01-incident",
      "source_lineage": [
        {
          "byte_range": {
            "end": 289,
            "start": 217
          },
          "character_range": {
            "end": 229,
            "start": 205,
            "unit": "utf16_code_unit"
          },
          "exact_text_sha256": "504887dcd575afc26e72221e0e7eb9fd975e957e6d45cafde1b2f01b0c8cb4e0",
          "source_kind": "accepted_source",
          "source_path": "artifacts/private-raster-case-digest/case-digest-script.md",